{
  "id": "6.1.1/lire-la-suite-seul",
  "referentiel": "RGAA",
  "version": "4.1.2",
  "test": "6.1.1",
  "titre": "« Lire la suite » sans contexte de destination",
  "verdict": "non_conforme",
  "nature": "pertinence",
  "modalites": [
    "html"
  ],
  "motif": "Le lien « Lire la suite » est seul dans son paragraphe. Il n'y a pas de titre précédent, et la phrase ne nomme aucune destination. Le test 6.1.1 n'est pas validé : ni l'intitulé ni un contexte ne font comprendre où le lien mène. Relecture sur la page du test le 22 octobre 2026.",
  "methode": "https://accessibilite.numerique.gouv.fr/methode/criteres-et-tests/#6.1.1",
  "statut": "revu",
  "fichiers": [
    "page.html"
  ],
  "licence": "etalab-2.0",
  "origine": "original",
  "cibles": [
    {
      "selecteur": "a",
      "note": "Lien dont le paragraphe ne contient que ces mots"
    }
  ],
  "relecture": "2026-10-22"
}
