{
  "id": "1.3.5/sans-embed",
  "referentiel": "RGAA",
  "version": "4.1.2",
  "test": "1.3.5",
  "titre": "Page sans image embarquée informative",
  "verdict": "non_applicable",
  "nature": "pertinence",
  "modalites": [
    "html"
  ],
  "motif": "La page ne contient aucune balise embed de type image. Le test 1.3.5 juge la pertinence de l'alternative ou du contenu alternatif d'une image embarquée porteuse d'information. Aucun embed n'est là : le test est non applicable. Le cas reste brouillon et le verdict ne sert pas encore de référence.",
  "methode": "https://accessibilite.numerique.gouv.fr/methode/criteres-et-tests/#1.3.5",
  "statut": "brouillon",
  "fichiers": [
    "page.html"
  ],
  "licence": "etalab-2.0",
  "origine": "original",
  "pieges": [
    "Conclure non conforme alors que l'élément visé par le test est absent de la page."
  ],
  "note": "Proposé pour les relevés de l'échantillon vitrine. Le verdict ne compte pas tant que le cas n'est pas revu."
}
