{
  "id": "1.2.3/sans-objet",
  "referentiel": "RGAA",
  "version": "4.1.2",
  "test": "1.2.3",
  "titre": "Page sans image objet décorative",
  "verdict": "non_applicable",
  "nature": "pertinence",
  "modalites": [
    "html"
  ],
  "motif": "La page ne contient aucune balise object de type image. Le test 1.2.3 vise ces objets lorsqu'ils sont décoratifs et sans légende, et demande aria-hidden, l'absence d'alternative et l'absence de texte entre les balises. Il n'y a pas d'objet : le test est non applicable. Le cas reste brouillon et le verdict ne sert pas encore de référence.",
  "methode": "https://accessibilite.numerique.gouv.fr/methode/criteres-et-tests/#1.2.3",
  "statut": "brouillon",
  "fichiers": [
    "page.html"
  ],
  "licence": "etalab-2.0",
  "origine": "original",
  "pieges": [
    "Conclure non conforme alors que l'élément visé par le test est absent de la page."
  ],
  "note": "Proposé pour les relevés de l'échantillon vitrine. Le verdict ne compte pas tant que le cas n'est pas revu."
}
