{
  "id": "1.3.8/sans-canvas",
  "referentiel": "RGAA",
  "version": "4.1.2",
  "test": "1.3.8",
  "titre": "Page sans contenu alternatif de canvas",
  "verdict": "non_applicable",
  "nature": "deterministe",
  "modalites": [
    "html"
  ],
  "motif": "La page ne contient aucune balise canvas, donc aucun contenu alternatif entre canvas et sa balise fermante. Le test 1.3.8 demande que ce contenu, lorsqu'il existe, soit correctement restitué. Il n'existe pas : le test est non applicable. Une passe de technologie d'assistance n'a pas d'objet ici. Le cas reste brouillon et le verdict ne sert pas encore de référence.",
  "methode": "https://accessibilite.numerique.gouv.fr/methode/criteres-et-tests/#1.3.8",
  "statut": "brouillon",
  "fichiers": [
    "page.html"
  ],
  "licence": "etalab-2.0",
  "origine": "original",
  "pieges": [
    "Conclure non conforme alors que l'élément visé par le test est absent de la page."
  ],
  "note": "Proposé pour les relevés de l'échantillon vitrine. Le verdict ne compte pas tant que le cas n'est pas revu."
}
