{
  "id": "1.2.4/sans-svg",
  "referentiel": "RGAA",
  "version": "4.1.2",
  "test": "1.2.4",
  "titre": "Page sans image vectorielle décorative",
  "verdict": "non_applicable",
  "nature": "pertinence",
  "modalites": [
    "html"
  ],
  "motif": "La page ne contient aucune balise svg. Le test 1.2.4 vise les images vectorielles décoratives sans légende, et demande aria-hidden, l'absence d'alternative, l'absence de title et de desc utiles, et l'absence d'attribut title. Une image appelée par une balise img n'est pas une balise svg. Le test est non applicable. Le cas reste brouillon et le verdict ne sert pas encore de référence.",
  "methode": "https://accessibilite.numerique.gouv.fr/methode/criteres-et-tests/#1.2.4",
  "statut": "brouillon",
  "fichiers": [
    "page.html"
  ],
  "licence": "etalab-2.0",
  "origine": "original",
  "pieges": [
    "Conclure non conforme alors que l'élément visé par le test est absent de la page."
  ],
  "note": "Proposé pour les relevés de l'échantillon vitrine. Le verdict ne compte pas tant que le cas n'est pas revu."
}
