{
  "id": "6.2.1/intitule-present",
  "referentiel": "RGAA",
  "version": "4.1.2",
  "test": "6.2.1",
  "titre": "Lien dont le contenu est un texte",
  "verdict": "conforme",
  "nature": "deterministe",
  "modalites": [
    "html"
  ],
  "motif": "Le seul lien est un élément a dont le contenu texte est « Mentions légales ». Le test 6.2.1 demande que le contenu du lien porte un intitulé, texte ou alternative. Ce contenu est un texte. Relecture sur la page du test le 22 octobre 2026.",
  "methode": "https://accessibilite.numerique.gouv.fr/methode/criteres-et-tests/#6.2.1",
  "statut": "revu",
  "fichiers": [
    "page.html"
  ],
  "licence": "etalab-2.0",
  "origine": "original",
  "cibles": [
    {
      "selecteur": "a",
      "note": "Seul lien de la page"
    }
  ],
  "relecture": "2026-10-22"
}
