{
  "id": "11.9.1/envoyer-le-message",
  "referentiel": "RGAA",
  "version": "4.1.2",
  "test": "11.9.1",
  "titre": "Bouton « Envoyer le message »",
  "verdict": "conforme",
  "nature": "pertinence",
  "modalites": [
    "html"
  ],
  "motif": "Le formulaire a un bouton dont le texte visible est « Envoyer le message », sans aria-label. L'intitulé décrit l'action, et le nom accessible est ce même texte. Le test 11.9.1, pertinence de l'intitulé et du nom, est validé. Relecture sur la page du test le 22 octobre 2026.",
  "methode": "https://accessibilite.numerique.gouv.fr/methode/criteres-et-tests/#11.9.1",
  "statut": "revu",
  "fichiers": [
    "page.html"
  ],
  "licence": "etalab-2.0",
  "origine": "original",
  "cibles": [
    {
      "selecteur": "button",
      "note": "Bouton d'envoi"
    }
  ],
  "relecture": "2026-10-22"
}
