{
  "id": "1.3.2/sans-zone",
  "referentiel": "RGAA",
  "version": "4.1.2",
  "test": "1.3.2",
  "titre": "Page sans zone d'image réactive",
  "verdict": "non_applicable",
  "nature": "pertinence",
  "modalites": [
    "html"
  ],
  "motif": "La page ne contient aucune balise area. Le test 1.3.2 juge la pertinence de l'alternative d'une zone porteuse d'information qui en a déjà une. Aucune zone n'est là : le test est non applicable. L'absence d'alternative, lorsqu'une zone existe, est un autre test. Le cas reste brouillon et le verdict ne sert pas encore de référence.",
  "methode": "https://accessibilite.numerique.gouv.fr/methode/criteres-et-tests/#1.3.2",
  "statut": "brouillon",
  "fichiers": [
    "page.html"
  ],
  "licence": "etalab-2.0",
  "origine": "original",
  "pieges": [
    "Conclure non conforme alors que l'élément visé par le test est absent de la page."
  ],
  "note": "Proposé pour les relevés de l'échantillon vitrine. Le verdict ne compte pas tant que le cas n'est pas revu."
}
