{
  "id": "1.2.1/sans-image",
  "referentiel": "RGAA",
  "version": "4.1.2",
  "test": "1.2.1",
  "titre": "Page sans image de décoration",
  "verdict": "non_applicable",
  "nature": "pertinence",
  "modalites": [
    "html"
  ],
  "motif": "La page ne contient aucune balise img. Le test 1.2.1 vise les images img décoratives sans légende, et demande un alt vide sans autre nom, ou aria-hidden, ou role presentation. Aucune image de ce type n'est là : le test est non applicable. Le cas reste brouillon et le verdict ne sert pas encore de référence.",
  "methode": "https://accessibilite.numerique.gouv.fr/methode/criteres-et-tests/#1.2.1",
  "statut": "brouillon",
  "fichiers": [
    "page.html"
  ],
  "licence": "etalab-2.0",
  "origine": "original",
  "pieges": [
    "Traiter l'absence d'image comme une image décorative non conforme."
  ],
  "note": "Proposé pour les relevés de l'échantillon vitrine. Le verdict ne compte pas tant que le cas n'est pas revu."
}
