{
  "id": "11.9.2/nom-contient-visible",
  "referentiel": "RGAA",
  "version": "4.1.2",
  "test": "11.9.2",
  "titre": "Le nom accessible est le texte du bouton",
  "verdict": "conforme",
  "nature": "deterministe",
  "modalites": [
    "html"
  ],
  "motif": "Le bouton affiche « Envoyer le message » et ne porte ni aria-label ni aria-labelledby. Le nom accessible est donc ce texte visible, qui le contient. Le test 11.9.2 est validé. La pertinence de l'intitulé est le test 11.9.1. Relecture sur la page du test le 22 octobre 2026.",
  "methode": "https://accessibilite.numerique.gouv.fr/methode/criteres-et-tests/#11.9.2",
  "statut": "revu",
  "fichiers": [
    "page.html"
  ],
  "licence": "etalab-2.0",
  "origine": "original",
  "cibles": [
    {
      "selecteur": "button",
      "note": "Sans aria-label"
    }
  ],
  "relecture": "2026-10-22"
}
